author,comment,published_at,likes,type
@aryankhandelwal37,"Its been 1 year and I'm not even able to reach to blue  , still on cyan",2020-04-08T23:15:37Z,0,Main Comment
@user-gp8fr1nd3w,Hi! I have trouble with implementing and understanding recursive solutions on data structures like Trees (I understand and can implement simple recursion). I tried practicing and solving problems but I feel like I'm missing something.. Any tips specifically for that?,2020-04-08T06:36:19Z,1,Main Comment
@bparanj,I have started to record videos on Mastering Recursion. The video series is divided into three modules. Total of 40 problems. I provide a systematic way to solve recursive problems. No memorization is required. Today I uploaded my first video in the series: https://www.youtube.com/watch?v=aFvY_aZPmqk&t=1s,2020-05-07T04:49:06Z,0,Reply
@melancholy-engineering,"Hello Errichto, thanks for the video and channel itself, as I know almost all Red Coders did their problems in C++, but I just hate this language (for my personal reasons). Mb you know some top competitive programmers that achieve this goal without C++? I'd be really happy to know at least one of them.",2020-04-08T00:52:35Z,1,Main Comment
@vaishnavdixit3044,but C++ does gives faster runtimes,2022-07-28T19:19:31Z,0,Reply
@jayshree9037,"When I was stuck I wasted days.
Now i knew that we are allowed to look. I wasted a lot of time.
And your tips are awesome, let's hope the best for me
And yes the main advice is practice",2020-04-07T19:27:50Z,0,Main Comment
@noobCoder0909,Read the editorial and get the clue if got stuck :),2020-04-07T19:17:46Z,0,Main Comment
@ambarishbanerjee414,Best channel ever on programming,2020-04-07T03:31:16Z,0,Main Comment
@mustafareda3063,is there anyone else faced this problem ? many times I can't solve a problem because I can't get what it needs exactly :(,2020-04-06T22:08:17Z,0,Main Comment
@dhruvsingh6540,"Thanks, very helpful advice !",2020-04-06T18:41:17Z,0,Main Comment
@_rohit_s,"(Thank_for_giving_info) => {
return practice;}",2020-04-06T08:54:06Z,0,Main Comment
@hardsystem9522,"Errichto where are you working man, Google or?",2020-04-05T21:01:28Z,0,Main Comment
@PratikSalunkhe13,is it rated? :),2020-04-05T19:29:29Z,0,Main Comment
@neet4vip0721,0. Born as a high-IQ person.,2020-04-05T18:32:26Z,0,Main Comment
@ahsanfarooq210,Is there a reason why lot of competitive programmers choose c++,2020-04-05T17:59:48Z,0,Main Comment
@gono_bf1,because it's fast,2020-04-07T02:09:08Z,0,Reply
@سيفالشمري-ض1ث6و,Hi but what about that book ?,2020-04-05T16:32:29Z,0,Main Comment
@jubairnaim62,whenever i ask people how can i improve myself for contests they told me that just practice or solve problems bt they didn't told me how to learn... first part of the video was awesome boss...,2020-04-05T14:26:21Z,12,Main Comment
@SuperMarioTomma95,Ok but how do I become red without practice?,2020-04-05T11:46:27Z,0,Main Comment
@mohitthorat8580,I have read you need to solve thousands of problems to become red. Is it true?,2020-04-05T11:26:28Z,0,Main Comment
@7daysmma,"Good advice, many place where applicable.  Thanks",2020-04-05T09:33:14Z,0,Main Comment
@gustavogonzalez7707,There is no royal road to competitive programming,2020-04-04T23:06:51Z,0,Main Comment
@ankitkesar,"As a medium level programmer 
Should I worry about time and space complexity",2020-04-04T21:57:04Z,0,Main Comment
@bparanj,Yes.,2020-05-07T05:32:01Z,0,Reply
@zimeckus7639,3:40 Errichto.exe stopped working,2020-04-04T16:43:24Z,123,Main Comment
@vinhpham2205,"I really want to know more tips, i love this video.",2020-04-04T16:20:46Z,0,Main Comment
@ShengLUO,Should I worry about stack overflow when doing recursive dfs?,2020-04-04T14:46:12Z,0,Main Comment
@rishabhsharma2744,What are your views about this code jam,2020-04-04T14:44:07Z,0,Main Comment
@vaderasss,"You could just say practice or take at least one online course... but no, a lot will fall for it..",2020-04-04T14:38:10Z,0,Main Comment
@ritwik-chakraborty,Hai errictoto love from India...you are really a good coder...can you make one discord server for more helps of other coders...,2020-04-04T14:01:08Z,0,Main Comment
@skyhi8958,i see i will try hard To Become Red Coder thank you,2020-04-04T11:50:25Z,0,Main Comment
@tej7725,That English accent of yours is kinda cool,2020-04-04T09:55:59Z,0,Main Comment
@jaspreetsingh8980,How do you keep your thoughts organised? When i read a problem my thoughts start racing in my head. Is it the same with you sir?,2020-04-04T09:17:14Z,0,Main Comment
@bparanj,"This question is like asking a chess grandmaster how he plays blind fold chess. They are experts, they can hold all the information inside their head. Others have to use pen and paper to create a model of the problem.",2020-05-07T05:13:36Z,1,Reply
@anubhavsinghal9218,"I can never forget this April fool joke, it literally fucked me for a sec.",2020-04-04T06:23:57Z,0,Main Comment
@hiranmoychowdhury5843,can you make an video on Edmonds Algorithm??,2020-04-04T01:37:04Z,0,Main Comment
@eudisd,I love the awkward pauses and re-starts.  Keep up the great work!,2020-04-03T19:08:58Z,7,Main Comment
@cocoarecords,Thanks,2020-04-03T18:48:07Z,0,Main Comment
@__shaun_,"Codeforces(X)
Mathforces(O)",2020-04-03T18:43:10Z,0,Main Comment
@abulhasnattonmoy,please upload a video about your coding biography,2020-04-03T14:02:57Z,0,Main Comment
@nonamehere9658,"DOES EVERY RED CODER HAVE A TEDDY BEAR?!?!?! ANSWER PLEASE, SIR!!!111ONE",2020-04-03T12:45:19Z,0,Main Comment
@purushottamparakh5165,"Hi Erichto, My questions are : 1. How do you elaborate all the test cases. I always miss some test cases. 2. I always try to solve a problem totally based on previous experience and end up writing very complex codes, The solution might be very straightforward but I could never think anything out of box. That irritates me a lot. 3. Off-by-one error is a real problem I face. How do you resolve such problem.",2020-04-03T09:27:24Z,0,Main Comment
@bparanj,"Developing the ability to think out of the box comes from reading the code written by developers who can think out of the box and understanding that code. For off-by-one error, you already know where your weakness lies, its just a matter of practicing so that your skill level progresses from conscious incompetence to conscious competence and eventually unconscious competence.",2020-05-07T05:08:58Z,1,Reply
@mythorganizer4222,0:32 that helped me very much thanks bye bye :D,2020-04-03T06:04:05Z,0,Main Comment
@unstable_diffusion,Errichto is the only person who can fire Google,2020-04-03T04:03:15Z,0,Main Comment
@brooksgunn5235,"""I'm never joking"" but at 0:00 you said to ME ""Hello Programmers"", lol!",2020-04-03T03:33:24Z,254,Main Comment
@dsdcp,This is because the content is not for you.,2021-05-02T13:03:27Z,2,Reply
@brooksgunn5235,"@dsdcp It wasn't, but it is moreso today :)",2021-05-02T13:13:55Z,2,Reply
@dsdcp,Have you accomplished hello world succecefully?,2021-05-02T13:20:40Z,0,Reply
@brooksgunn5235,"@dsdcp No, it's difficult, but I'm working on it 😔",2021-05-02T14:34:20Z,0,Reply
@dsdcp,"@brooksgunn5235 Relex, sometime the thing will become part of you and then, voilá.",2021-05-02T21:06:40Z,1,Reply
@abdessalam8468,Please i need course c++,2020-04-03T00:11:39Z,0,Main Comment
@gorge9774,A mógłbyś zrobić poradniki po polsku ? 😅😃,2020-04-02T23:43:53Z,0,Main Comment
@MohamedRT,"Personally I loved the fourth tip, I think it relates most, and more effective!",2020-04-02T22:19:29Z,0,Main Comment
@DeepakYadav-rx2qg,"Hi Erichto,
I am currently working in an IT company. Will it be a good time for me to start competitive programing?",2020-04-02T21:31:57Z,0,Main Comment
@gorgono1,Tip #1: learn to code,2020-04-02T21:15:24Z,0,Main Comment
@damercy,Kamil's the best!,2020-04-02T19:26:47Z,0,Main Comment
@premkumars6510,"How to become red pranker! 
5 tips: 1) Don't say video is over in 1st min .. 2)to 5) Don't ask.",2020-04-02T18:49:07Z,0,Main Comment
@sherlock-z1d,What are your favorites books on C++ ?,2020-04-02T18:42:35Z,0,Main Comment
@anakinskywalkerrr,"Beside the good tips, keep the humor too bro lol",2020-04-02T17:46:56Z,0,Main Comment
@narayanbhat3279,I hardly see you laugh,2020-04-02T17:38:15Z,0,Main Comment
@abhishek-hb1vg,"Hey i have been following you for a while now. And what i have come to notice is that you r quiet a legend in the competitive reprogramming world.
 I am a selftaught programmer and currently iam doing an internship as a react developer. So i have started learning DS and Algorithm  but i didn't find a good website to practice using JavaScipt can you give some suggestion.",2020-04-02T17:22:36Z,1,Main Comment
@AMG-gc4io,I need someone to help about a program problem,2020-04-02T15:47:51Z,1,Main Comment
@zillboy,"Hah, I really thought he's gone!😂",2020-04-02T14:39:23Z,2,Main Comment
@johnhammer8668,"I thought you are going to recommend a C++ book looking at the thumbnail.
Why do competitive programmers choose the most difficult language C++ ?
What book did you and other competitive programmers use to learn C++ ? More Effective C++ ?
Do the competitive programmers ever use templates in the competitions ?
Thanks so much Errichto. Visiting your channel is like visiting a rich friends home, where there are lots of cool things .",2020-04-02T14:13:52Z,1,Main Comment
@AshishKumar-kz2sp,"Hey there, I a new at coding and knows only basics, I started solving problems on codeforce but the all the problems seems to hard for me, i can hardly solve 2 problems from 10. What should i do to do better in it.",2020-04-02T14:08:04Z,0,Main Comment
@bparanj,You have to work your way up to it. Start with easy problems and gradually move on to medium and eventually to hard ones.,2020-05-07T05:31:44Z,0,Reply
@kajetanwojnarowski2693,"Polska uczyć jak być czerwonym, no co się dzieje!

Dobre rady btw 😁",2020-04-02T13:05:52Z,0,Main Comment
@infofan4824,"Jaka jest maksymalna liczba słów, które możesz wpisać na minutę na komputerze?",2020-04-02T11:50:19Z,0,Main Comment
@rawtechfun2581,What according to u is a medium level coder on codeforces ratingwise?,2020-04-02T10:53:05Z,0,Main Comment
@JamiulBari,Did you forget to talk about those books?,2020-04-02T10:05:03Z,0,Main Comment
@divyenayy5973,When should we start doing leetcode questions??,2020-04-02T09:59:28Z,1,Main Comment
@bparanj,"If you have the fundamentals, you can start doing leetcode questions. If you are a beginner start with easy ones and work your way up to medium and difficult problems.",2020-05-07T05:01:24Z,0,Reply
@alradi1041,"Sometimes I spend more than 30 minutes to solve a problem and usually I get somewhere, but takes more time. Are you suggesting that we look at editorial if we're 100% clueless about a problem for 30 mins? What if 70% clueless",2020-04-02T09:32:26Z,0,Main Comment
@bparanj,In that case you need a slight hint. Hints can get stronger to get your creating juices flowing again.,2020-05-07T05:03:16Z,1,Reply
@HuzaifaJalali,"I listened to it 3 times, still I think he said: You fucked the video was over",2020-04-02T09:11:42Z,0,Main Comment
@tonystarc9567,Thank you brother....,2020-04-02T09:01:23Z,0,Main Comment
@raghavupadhyay7100,Where r u from,2020-04-02T08:55:27Z,0,Main Comment
@raghavupadhyay7100,Where r u from,2020-04-02T08:55:27Z,0,Main Comment
@hajji384,GPS,2020-04-02T08:13:27Z,0,Main Comment
@jean-michelcid9594,red coder... clealy a communist dog whisle lol,2020-04-02T08:12:51Z,0,Main Comment
@satthu7593,Helpful 👏,2020-04-02T08:01:41Z,0,Main Comment
@MultiKaloudis,I like the video because of your sense of humour 😆,2020-04-02T07:55:36Z,0,Main Comment
@lucasnogueira3232,I LOVE ur videos :3,2020-04-02T06:35:12Z,0,Main Comment
@mahatejvarma2998,Hey Errichto..Could u make videos on Digit dp.. or suggest a good resource for learning it.,2020-04-02T06:23:01Z,0,Main Comment
@anuranjankumar3989,"Yes yes yes ..... you are funny.
Loved it.😀😂",2020-04-02T06:16:40Z,0,Main Comment
@tannerbarcelos6880,I can print hello world in multiple languages. I can be red,2020-04-02T06:16:12Z,0,Main Comment
@FazeelUsmani,How much time it takes to become a red coder?,2020-04-02T06:14:06Z,0,Main Comment
@antopiahk8655,I'm moving to cpp from python. any recommendations for ide?,2020-04-02T05:08:05Z,0,Main Comment
@boongbaang1124,"Man I can just watch you speak. You're so humble, and  you speak with such calmness and confidence that makes me admire you so much. Lots of best wishes to you, and keep making these videos  for us.",2020-04-02T02:58:58Z,23,Main Comment
@yunjiehong4649,"The real question is, how to become a grey programmer? During New Years !",2020-04-02T01:30:23Z,0,Main Comment
@lifeisnotvibestv5124,exactly my professor 0:37,2020-04-02T01:23:06Z,2,Main Comment
@RishabhDeepSingh,ERrichto is best.,2020-04-01T23:35:05Z,0,Main Comment
@aanchalsharma5264,You are too good 😊,2020-04-01T22:57:29Z,0,Main Comment
@lisztk1928,"Thanks, it's really helpul
I'm a beginner but hopefully will be able to get to the top",2020-04-01T22:46:21Z,0,Main Comment
@AnandPandeyHere,https://youtu.be/uPwjKC6cGF4,2020-05-05T19:27:17Z,0,Reply
@piqueselio,I like those short videos where you share your experience and give advice. I find them very valuable :). Thanks for posting those and sharing ;).,2020-04-01T21:18:33Z,1,Main Comment
@ayushmahajan3389,"Errichto: It's a spoiler if something if from a category
Codechef Questions be like: So you want to buy an array for your ""friend"" birthday. LOL",2020-04-01T21:11:15Z,21,Main Comment
@adnansamol8464,Ayush Mahajan codeforce be like: petya got two strings in gift from his mother.,2020-06-02T19:25:15Z,5,Reply
@thatoneguy6665,"Hey Errichto, loved the video, any chance you could do a video on how to setup a CP environment using Geany in windows?",2020-04-01T20:53:49Z,1,Main Comment
@jimmyshenmusic,Your t shirt looks great. Where can we buy it? At least we can have the same t shirt if having similar coding skills is not possible within a very short time.,2020-04-01T20:21:21Z,0,Main Comment
@AlexSav,"Just be
  a) Smart
  b) Fast
  c) Work a lot",2020-04-01T20:05:45Z,0,Main Comment
@abhishekabraham4107,Thanks a lot Errichto... I respect your skills and willingness to share your tips. Thank you. Goodluck,2020-04-01T19:59:03Z,0,Main Comment
@Anveshana837,Thanks one of the finest videos.,2020-04-01T19:47:37Z,1,Main Comment
@sauravkarmakar3704,0:34 what was that,2020-04-01T19:46:32Z,1,Main Comment
@MiketheCoder,"""Just do more problems"" - Errichto

You mean I can't just pay for a course online and expect to become an algo expert? /s",2020-04-01T18:53:03Z,171,Main Comment
@Cynbell07,go back to reddit,2020-04-03T21:21:15Z,10,Reply
@MiketheCoder,@Cynbell07 it's a joke about online courses like algopro and algoexpert,2020-04-03T23:57:12Z,37,Reply
@SMR8344,@MiketheCoder  Bro can you give some tips to become a good programer how to start from beginning because I'm beginner started my career plz as a senior plz give me some tips 🙏🙏,2020-06-08T10:27:19Z,1,Reply
@MiketheCoder,"Naani Mahesh You can start by doing a lot of projects that interests you. You can create a web scraper, or a website or anything. Just make it something you want to create and focus just on that. After that, put it on your portfolio and apply to jobs.",2020-06-09T00:13:23Z,2,Reply
@YOLO-qf1te,Happy 69 likes ;),2020-10-13T05:02:32Z,0,Reply
@DharanAditya,Thanks Bro. It was really helpful.,2020-04-01T18:46:31Z,0,Main Comment
@andrewchen1744,Like tis video. Thank you!,2020-04-01T18:30:57Z,0,Main Comment
@lawrancej7473,You Look Great Brother,2020-04-01T18:27:35Z,1,Main Comment
@faraznaseem928,I_love_Tanya_Romanova .... aka ..... Bohdan Pryschenko.,2020-04-01T18:02:22Z,0,Main Comment
@markusbuchholz3518,"Thanks  you Errichto for your amazing channel. Great to follow you and also Clément Mihailescu, his channel and amazing portal AlgoExpert.io.",2020-04-01T17:57:56Z,0,Main Comment
@greenya84,"Why in the description it says ""5 simple tips..."" if i found only one -- ""practice a lot"". And for some reason 30 sec video shows to me as 4 min one, seems like some YouTube glitch.",2020-04-01T17:53:30Z,0,Main Comment
@msh104utube,"3:40, syntax error...",2020-04-01T17:19:34Z,1,Main Comment
@ajitesh764,"I think u forgot to turn on the monetization again.... Anyways I mentioned you were going to recommend something for ' Sufficient math needed for CP'... Would u mind replying to that request. Or may answer to that query in the next video...
A big thank u for ur effort to make these video :-)",2020-04-01T17:01:23Z,0,Main Comment
@StijoBitsInBytes,you are an inspiration for small youtubers like me,2020-04-01T15:58:35Z,0,Main Comment
@lelcetz7628,"step 1) learn how to code
step 2) read the communist manifesto
step 3) seize the means of production",2020-04-01T15:41:00Z,0,Main Comment
@jdhp3696,"Related to your thumbnail, can you do a video on your favorite / recommended programming books?",2020-04-01T15:39:30Z,4,Main Comment
@blackside7108,Please tell us what kind of math background do we need in programming?,2020-04-01T15:35:32Z,0,Main Comment
@wildanfajri9745,"I love your video now, cause you put some entertaiment element on it, That's gonna be easy to understand",2020-04-01T15:33:07Z,0,Main Comment
@gauravkumarpandit7022,"I find harder to select problems but I have selected some problems here .copy paste the below link in your browser

 https://www.notion.so/f980d682531e4e5d81989f6c6f618352?v=fb1be7d8ee824ed9a3ebe1772691286c",2020-04-01T15:28:23Z,0,Main Comment
@shivamjalotra7919,Cool,2020-04-01T15:23:02Z,0,Main Comment
@shahirabdullah5438,You are the best <3,2020-04-01T15:19:05Z,0,Main Comment
@arpitmishra8399,Is it rated was the first question of April Fool Contest today!,2020-04-01T15:13:27Z,1,Main Comment
@giuseppeguap7250,did u glitch at the end or,2020-04-01T14:43:10Z,0,Main Comment
@jurekogorek2484,does being good at Minecraft help?,2020-04-01T14:39:51Z,0,Main Comment
@carljustinemosquida9614,"While creating resume, would you put a bullet that describes "" Im a red coder at codeforces"" ? Or ""competitive programmer""",2020-04-01T14:31:35Z,0,Main Comment
@codepath-insights,love u errichto,2020-04-01T14:30:34Z,0,Main Comment
@raselhasan2433,"I think there is only one tips and that is solve solve and solve random problems that you mentioned first, anyway thanks.",2020-04-01T14:24:34Z,0,Main Comment
@rohitbakoliya,Most funniest video ❤️❤️,2020-04-01T14:21:38Z,0,Main Comment
@reddynishanth3936,Was the thumbnail part of April 1st too?,2020-04-01T14:17:28Z,0,Main Comment
@sakibshahon,NEED HELP!! How do know what is my current level or what level of difficulty should a problem have for me to solve?,2020-04-01T14:17:04Z,0,Main Comment
@gngamestudio,bro pensilo shilko menko binko hinko lol,2020-04-01T18:58:23Z,0,Reply
@bparanj,Can you solve easy problem? How about medium? or hard? It's like lifting weights. You will know where your limit is by lifting weights. You will know your level by solving problems.,2020-05-07T05:24:19Z,1,Reply
@sakibshahon,can solve Codeforces A and B most of the time. 10-20 minutes for solving A and 30-40 minutes for solving B.,2020-05-07T11:04:51Z,0,Reply
@bparanj,@sakibshahon You will gain speed by working on the problems that takes long for you now by solving it multiple times over a period of time . Spaced repetition is also very effective.,2020-05-07T19:17:23Z,1,Reply
@sakibshahon,@bparanj thanks a lot makes sense.,2020-05-08T08:01:54Z,0,Reply
@hurshsingh4913,Hail  Errichto,2020-04-01T14:10:29Z,0,Main Comment
@ankushmitra5185,"I am just starting codeforces ,able to solve A,B in div 2 . How much time it can take to be a red coder .. (approx)",2020-04-01T14:05:55Z,0,Main Comment
@takamuramamoru7972,nice joke bro hhhh,2020-04-01T13:55:20Z,0,Main Comment
@ahidalgo94,2:15 Is it true they all listen to TWICE before contests?,2020-04-01T13:37:39Z,2,Main Comment
@sishubjoshi,what??,2020-04-02T16:50:59Z,0,Reply
@Skanderthabet,So what book do you recommand plz ?,2020-04-01T13:36:24Z,0,Main Comment
@coderwanttobedesigner4788,a red... what xD,2020-04-01T13:25:43Z,0,Main Comment
@tuanva6484,I'm not good at math :(( how to reach red target :((,2020-04-01T13:11:03Z,0,Main Comment
@bparanj,Mathematics is just formalization of visual thinking. Are you good at visualization? Einstein used to visualize before he documented them using Math.,2020-05-07T05:26:17Z,0,Reply
@Amanmaverick,@Errichto how to gain interest in programming problems? I'm very bored of coding. Pls help.,2020-04-01T13:03:42Z,0,Main Comment
@sujalgupta6100,I just realised you made us April Fool with that book in the thumbnail.,2020-04-01T12:54:37Z,0,Main Comment
@hamza_x98,You did a joke.,2020-04-01T12:52:48Z,0,Main Comment
@josephnicholasalcantara3148,"Hey, great video. Just wanted to ask, DS and Algorithms are really my weakness, and I am already 30 years old, do you think its still not too late to start CP. Thanks",2020-04-01T12:52:31Z,1,Main Comment
@hieudoan7711,It's likely playing chess for me =)) It's fun and attractive. You should try yourself at least,2020-04-01T13:07:44Z,1,Reply
@bparanj,What does age have to do with it? KFC founder started his franchise at age 62. Are you saying because you are 30  you don't enjoy coding anymore?,2020-05-07T05:17:50Z,2,Reply
@MrVoidHunter,Practice and don't waste huge time for thinking  if you beginner...,2020-04-01T12:50:40Z,0,Main Comment
@rentib9136,"If someone is interested in the text on Errichto’s shirt, it is - Ladies and gentelmen, this is a bear",2020-04-01T12:42:43Z,214,Main Comment
@rajab4187,Oh thanks 😊,2020-04-02T13:28:06Z,1,Reply
@lalitor,Now I want that shirt,2020-04-05T16:05:42Z,6,Reply
@Torchl146,underrated Comment,2020-09-29T09:10:29Z,0,Reply
@_boris,Good man Errichto,2020-04-01T12:37:41Z,0,Main Comment
@cmp4727,first tip was great.Practice😂,2020-04-01T12:19:14Z,0,Main Comment
@Rez0rect1,Wow y'all are up early,2020-04-01T11:55:21Z,0,Main Comment
@arun_explores_vlogs,I see your sense you humour improved brother :) .,2020-04-01T11:51:04Z,8,Main Comment
@jenniefine9456,If we stuck on a problem then without waste time directly go to editorial😁 i like this part.,2020-04-01T11:38:34Z,1,Main Comment
@MindKnightSage,"Errichto has become funny!
What if he continues this even in his long streams?!",2020-04-01T11:37:37Z,6,Main Comment
@B1NARYS0LD1ER,Kamil is getting better in YT. He's become my favourite,2020-04-01T11:37:18Z,1,Main Comment
@fiziblank2609,Thank you for your knowledge.,2020-04-01T11:30:51Z,0,Main Comment
@iamtrash288,"Simple but very useful advice. I remember there was that one time when I couldn't solve a problem for a week and then I went ""To fuck with it, I'm so done"" and didn't write a line of code for like a month...",2020-04-01T11:20:06Z,1,Main Comment
@tanishqgupta1071,Hey Errichto can you suggest a book to learn c++ completely,2020-04-01T11:01:22Z,0,Main Comment
@hash1602,From which site to practice is best spoj or codeforces,2020-04-01T10:55:01Z,0,Main Comment
@_Ani_,"""Hello Programmers"" at the very end, with a faceshift",2020-04-01T10:52:31Z,20,Main Comment
@babayaga1698,🥺🥺🥺...Thankyou so much....🥺🥺,2020-04-01T10:49:29Z,0,Main Comment
@danilzashikhin3591,Kamil how much have you paid for 85k followers?,2020-04-01T10:44:47Z,1,Main Comment
@Errichto,"well, for how much would you subscribe too?",2020-04-01T11:18:13Z,2,Reply
@danilzashikhin3591,@Errichto I don't follow clowns,2020-04-01T11:22:29Z,1,Reply
@wian7284,"@danilzashikhin3591 oh so here you must be making sure how are clowns doing. Sweet of you. 
Thanks. F*** off",2020-04-01T16:26:41Z,0,Reply
@rishabhverma3926,Thnks buddy !!!! April is a good month to start with these tips on problems.,2020-04-01T10:43:38Z,0,Main Comment
@DurgeshKumar-pv6pm,First five seconds like : kat gaya,2020-04-01T10:43:17Z,0,Main Comment
@Kemot27,"Proszę państwa oto miś XDDDD
4:04 ZŁOTO",2020-04-01T10:42:47Z,0,Main Comment
@anna_inu,"I see useful the ""don't get stuck on a problem"". Better read the analysis than get frustrated and throw the computer away.",2020-04-01T10:42:08Z,22,Main Comment
@prasadsolleti3870,🤣🤣🤣,2020-04-04T13:36:39Z,1,Reply
@МейрбекБолатбеков-ж6д,Same bro ((,2020-04-21T12:59:05Z,1,Reply
@isobeyan,is this an april fool joke!! it's hard to believe,2020-04-01T10:40:40Z,0,Main Comment
@nguyencongthanh778,wow so inspiring,2020-04-01T10:32:41Z,0,Main Comment
@djmilen4o,Great video!,2020-04-01T10:19:26Z,0,Main Comment
@rexzohh,make a how to get started with programming,2020-04-01T10:18:25Z,0,Main Comment
@Justin49154,"Я,конечно,не знаю английский,но что он говорит я почему-то понимаю",2020-04-01T10:17:07Z,0,Main Comment
@pranshuprodipta2814,Thank you. It was very helpful.,2020-04-01T10:10:15Z,0,Main Comment
@-__--__,"Oh wow u are a programmer, but u know what is a pus*y? Hahahaha fckin virgin",2020-04-01T10:09:40Z,0,Main Comment
@truth_tablets,xD,2020-04-01T10:00:53Z,0,Main Comment
@TahsinAhmed-yj9ns,"really thought that it was a april fool joke, u got me there buddy! and as always nice video <3",2020-04-01T10:00:06Z,0,Main Comment
@gena8414,Errichto knows how to draw the Indian audience.,2020-04-01T09:56:26Z,8,Main Comment
@md.sayeedrahman2553,practice more! okay bye! tada! :D,2020-04-01T09:54:22Z,0,Main Comment
@mandeepvayeda8029,who is Tanya Romanova?,2020-04-01T09:53:46Z,0,Main Comment
@danilzashikhin3591,Read this comment https://codeforces.com/blog/entry/18021?#comment-229952,2020-04-01T11:45:30Z,0,Reply
@elandor3084,"errichto u 're the best
u make me fking laugh like a stupid",2020-04-01T09:52:34Z,0,Main Comment
@shubhamkumar6772,"Can you tell me In iterative dp, how to choose which loop place first and which loop i should place after.",2020-04-01T09:50:47Z,0,Main Comment
@kc2838,No,2020-06-03T13:18:19Z,1,Reply
@xsharawi,i liked them all and will do them all,2020-04-01T09:49:02Z,0,Main Comment
