author,comment,published_at,likes,type
@sophiesparkle2464,This make so so much sense and do love the video,2020-04-01T09:46:26Z,0,Main Comment
@IdliShambharDosaDosa,Lol....,2020-04-01T09:46:19Z,0,Main Comment
@mayankverma3690,"sir, can u make video on roadmap for competitive programming like first c++ then STL ,then what after?",2020-04-01T09:44:25Z,0,Main Comment
@Errichto,Then solve problems...,2020-04-01T09:44:52Z,7,Reply
@carlosj3491,"So funny, I just stared there at my desk waiting for something else. I like a lot your videos, I hope you could make more videos in the future.",2020-04-01T09:33:47Z,5,Main Comment
@RohitSharma-bc3ce,Maybe lock down is a good time to start grinding for that. Thanks foe the tips @Errichto really needed those tips.,2020-04-01T09:30:57Z,0,Main Comment
@fxexile,0:33 you fuck the video is over,2020-04-01T09:30:08Z,0,Main Comment
@sandippal8088,I thought he's gonna say the only thing is practice practice anf practice.,2020-04-01T09:28:02Z,0,Main Comment
@suvadeepghoshal,Hey ericchto you have grown your domain so much why don't you activate moneytization,2020-04-01T09:25:47Z,0,Main Comment
@dhananjaychoudhary7836,That was the best pause I've ever seen/heard,2020-04-01T09:24:02Z,2,Main Comment
@Errichto,"If you can see and hear pauses, I'm afraid you should see a doctor ;_;",2020-04-01T09:40:09Z,5,Reply
@sufyan2317,@Errichto 😂😂😂,2020-04-01T10:05:04Z,0,Reply
@uditnair90,I just love you..,2020-04-01T09:23:49Z,0,Main Comment
@ItumelengS,"Hello Programmer, I will but not now",2020-04-01T09:23:35Z,0,Main Comment
@xordux7,Meh 😑 I didn't knew it's 1st April till I saw this video...and you managed to fool me twice 😏,2020-04-01T09:21:24Z,0,Main Comment
@syeda.k.2934,"Nice, add more bloopers in end.",2020-04-01T09:19:13Z,0,Main Comment
@shahbazalam3722,Could you please make a video on this concept. https://codeforces.com/blog/entry/68953,2020-04-01T09:12:26Z,0,Main Comment
@muhammadtahsinamin2445,"how to improve my conceptual basic on stl 
In c++.
Plz Give some resources..",2020-04-01T09:06:59Z,1,Main Comment
@gamegamesoumic,2:55 How much time to wait if I get stuck? 20 to 30 minutes?,2020-04-01T08:59:37Z,0,Main Comment
@Amit.Locham,If you think that you are making progress toward solution then it will be better if you stick with your approach even more then 30 min. Otherwise If after 20 min still you have no idea about the solution then go for editorial. There is no fix time limit as it is also possible that you pick up a problem which might be not of your level but it is marked as beginner/medium level .,2020-04-01T09:36:30Z,1,Reply
@Errichto,"Just notice that it's 20-30 minutes of BEING STUCK. If you have new ideas and investigate them, continue with that. SEE EDITORIAL AFTER 20-30 OF NOT MAKING ANY PROGRESS WHATSOEVER AND HAVING NO IDEAS TO TRY.",2020-04-01T09:42:42Z,1,Reply
@gamegamesoumic,@Errichto Thank you!,2020-04-02T12:33:18Z,0,Reply
@ananyamahato479,"What about the book which u are holding.
Is it good for beginners???",2020-04-01T08:54:01Z,0,Main Comment
@pranjalagnihotri6072,"When red coders don't remember exactly what they have done to become blue from green, because its  quite some time now for them then they say { ""practice is only the key"" , ""solve lot of problems"" }  and it means really ""nothing"". You can ask a blue coder instead who recently got there he will tell you exact things. (** But Errichto seems to remember a lot ** )",2020-04-01T08:52:04Z,57,Main Comment
@glzr_io,"NRG CODE if you scroll up a bit, there's actually a video about it right there",2020-05-15T20:56:24Z,5,Reply
@tomas95go,"No BS, no clickbait, straight to the point plus a little joke, nice.",2020-04-01T08:50:30Z,1,Main Comment
@mahdi7d1rostami,because of my math background i enjoy soving project euler problems. But lots of the times these problems are related to some specific math concepts that you should check and learn about it. So it takes more for me solving project euler problems but i like it.,2020-04-01T08:47:29Z,0,Main Comment
@angiras07,Is clrs outdated and should i not use it as reference,2020-04-01T08:46:20Z,0,Main Comment
@Errichto,It isn't good for CP.,2020-04-01T09:43:55Z,0,Reply
@angiras07,@Errichto which book should i refer to,2020-04-01T09:52:28Z,0,Reply
@marcuslee678,"Bro, did u just forgot to edit the last part?😂",2020-04-01T08:44:54Z,0,Main Comment
@RAJPATEL-nm9nz,Errichto u r very nice person. I mean very down to earth person,2020-04-01T08:43:01Z,0,Main Comment
@clem,"Those first 30 seconds are #truth though—and not just for competitive programming, but for any skill or endeavor. The rest is all bonus 😛",2020-04-01T08:41:10Z,2760,Main Comment
@兴宣大院君-h4s,Clément Mihailescu code doesn’t sleep,2020-04-01T08:59:54Z,15,Reply
@xordux7,Yeah! Bonus tips are gold 🥇,2020-04-01T09:19:54Z,4,Reply
@Errichto,"New pitch for algoexpert main page: ""Doctors hate him! Check how he nailed his coding interviews with this ONE WEIRD TRICK.""",2020-04-01T10:04:18Z,503,Reply
@clem,@Errichto 😂You'll see it live on the homepage soon.,2020-04-01T20:12:49Z,94,Reply
@kodetumbuh,Hey i love your drama with your partner sir,2020-04-02T15:30:06Z,1,Reply
@rahulsbhatt,"The joke at start was really good, haha a good video as always Errichto!",2020-04-01T08:40:05Z,4,Main Comment
@siddharthajain193,"@Errichto I know practice is everything but there are some topics which come rarely such as digit dp , whenever question of it comes it's very hard to implement it as it has been a long time when I learn that topic.
What you do in this case.",2020-04-01T08:39:26Z,0,Main Comment
@jameshello38,Errichto what's your iq? If you have great iq than I won't bother trying. 😒,2020-04-01T08:39:22Z,0,Main Comment
@Errichto,more than 5,2020-04-01T09:45:40Z,0,Reply
@Errichto,"iq tests are stupid, don't think about them and their results.",2020-04-01T09:46:22Z,0,Reply
@jameshello38,@Errichto thanks man. I dream of competing with you and tourist some day. Just don't retire for at least 10 years from now 😂😂,2020-04-01T12:53:37Z,0,Reply
@TheMasterfulcreator,It would be funny if the left part of the graph was labeled 'stupid people'.,2020-04-01T08:38:13Z,1,Main Comment
@Martykun36,"no, not really",2020-04-01T18:34:35Z,0,Reply
@TheMasterfulcreator,"@Martykun36  you're a very boring, unimaginative person with low intelligence.",2020-04-01T18:54:52Z,0,Reply
@karanb2067,first,2020-04-01T08:36:45Z,0,Main Comment
@sahilsharma2952,Humour in your videos is rising exponentially.,2020-04-01T08:35:05Z,1,Main Comment
@MoMoCoCo69,"best video to start april 


go beyond plus ultra",2020-04-01T08:35:02Z,0,Main Comment
@whitepaperdecode101,1st one is the best tip,2020-04-01T08:33:35Z,0,Main Comment
@Player-ub9tg,"The most  important  tip :

Watch Errichto's videos.",2020-04-01T08:31:27Z,95,Main Comment
@AnujTripathi9,Sir please want your WhatsApp number,2020-04-01T08:30:52Z,0,Main Comment
@prarinamderia309,Piz make video on tries,2020-04-01T08:30:52Z,0,Main Comment
@HelloWorld-sy4yc,"I've 1800+ in the codeforces. And I wanna say, that u r right and tell us about my preparation. Guys, just thorough preparation...",2020-04-01T08:30:41Z,7,Main Comment
@AvinashKumar-mk2ti,Can you tell that approximately how many problems you have solved till now? I am just asking for some motivation.,2020-04-01T08:30:03Z,0,Main Comment
@Errichto,"maybe 2500 solved and AC, plus another 2500 where I heard a statement and know a solution (no code though)
so, let's say I know solutions for 5000 problems",2020-04-01T09:48:42Z,0,Reply
@AvinashKumar-mk2ti,"@Errichto Thanks. I think that the best way to solve problems is to  first solve few problems of specific topic. Do this for every topic(few problems from every topic), and In between solve random problem also, so that you can solve problems where more than one topics are used(For ex: trees and DP). What is your opinion?",2020-04-01T10:05:51Z,0,Reply
@AvinashKumar-mk2ti,"@Errichto Also, can you help me with how you made your numbers theory strong?",2020-04-01T10:06:47Z,0,Reply
@AvinashKumar-mk2ti,@jalsol Thanks. Actually he has solved almost 5000 problems till now.,2020-04-01T10:07:49Z,0,Reply
@bparanj,@AvinashKumar-mk2ti Interleaving is the best way to study: https://drive.google.com/open?id=1RN4rpaHWv3llnYw8F1Fyh6CJBI_s1Je5,2020-05-07T05:51:27Z,0,Reply
@godryk7594,Czy ty nie jesteś przypadkiem Polakiem?! Ta bluzka daje sporo do myślenia :) ;p,2020-04-01T08:23:43Z,0,Main Comment
@Errichto,żółć,2020-04-01T09:44:10Z,1,Reply
@ezwalduzumaki3161,"errichto, i wanna find a fulltime job this year, front end dev, and after that i wanna do c++ and cp in my freetime :D",2020-04-01T08:22:43Z,1,Main Comment
@mehulkasliwal7036,"It would've actually been so cool if you ended the video at you have to practice, considering April fools...",2020-04-01T08:22:10Z,0,Main Comment
@Errichto,"For some reason I thought that putting some useful advice will be, well... useful.",2020-04-01T09:41:09Z,1,Reply
@mehulkasliwal7036,@Errichto You got me there in the starting though. BTW nice video.,2020-04-01T10:11:56Z,0,Reply
@Roadto10x,"You got me Errichto
Thought you would end at Practice!",2020-04-01T08:21:19Z,0,Main Comment
@aakashyadav8327,Hello @Errichto i love your videos..but please can u increase the volume...in adobe premiere pro u can do that by right click ur track--audio level and enter a positive no,2020-04-01T08:19:25Z,0,Main Comment
@vincentvega3076,"Step 1: Buy a red computer
Step 2: Make your wallpaper red
Step 3: Get VS code and set a red theme 
Step 4:  Learn a red programming language (Scala, R and anything that has a red logo)
Step 5: Learn a red JS framework (Angular)
Step 6: Create an app and make sure it's red
Congrats, you are now a red coder
This video is just trash - follow all the steps above and you will be a red coder in no time",2020-04-01T08:19:13Z,0,Main Comment
@Errichto,Step 0: Take a bath in red paint.,2020-04-01T09:50:17Z,3,Reply
@zldaq5040f,Great video!,2020-04-01T08:17:36Z,0,Main Comment
@amankrx,"I see you use scanf and printf. Is there a problem in using cin, cout using ios_base::sync_with_stdio(false). 
Or you are just confident with scanf and printf.",2020-04-01T08:16:56Z,0,Main Comment
@Errichto,"This is how I learned, but it's ok for you to use cin/cout.",2020-04-01T09:47:13Z,0,Reply
@amankrx,Thanks a lot,2020-04-01T11:13:46Z,0,Reply
@ChompNom,glad to see you trying to get into the youtube game,2020-04-01T08:13:40Z,0,Main Comment
@shahimran7421,sir started learning programming c++ language,2020-04-01T08:12:18Z,0,Main Comment
@haythamkenway8343,"Hey, Errichto currently I'm learning backend web development as I'm already a front-end developer. Should I focus on competitive programming rather than web development???",2020-04-01T08:10:37Z,0,Main Comment
@tagberli,"It's awesome to see that you developing in video content, editing, adding some jokes and also don't lose usefulness of content, thank you for your advice, but also it's a little bit obvious and I just watched this video because they are awesome =)",2020-04-01T08:07:31Z,2,Main Comment
@shashwattripathi759,fav. video so far <3,2020-04-01T08:07:01Z,0,Main Comment
@jayvasant114,Which book is in the thumbnail?,2020-04-01T08:06:54Z,0,Main Comment
@Errichto,"Thinking in C++, but I didn't even read it :>",2020-04-01T09:45:21Z,2,Reply
@dubey1akash,Bye bye well crafted,2020-04-01T08:06:34Z,0,Main Comment
@PavanKumar-jt5mq,Smh Clickbait of the year.,2020-04-01T08:01:30Z,1,Main Comment
@Errichto,"thanks, that means a lot",2020-04-01T09:43:29Z,0,Reply
@PavanKumar-jt5mq,"@Errichto XD the Content is the same ""practice""",2020-04-01T10:15:08Z,0,Reply
@tagberli,"You need to practice, bye bye thank for a watching😂👌",2020-04-01T08:00:17Z,18,Main Comment
@kushaltandon7720,"You should do a ""day in life of a competitive programmer"" that'll be interesting to watch",2020-04-01T08:00:01Z,1411,Main Comment
@jurekogorek2484,@Rui Kashaire or vodka and energy drinks instead of coffee,2020-04-01T14:38:48Z,45,Reply
@YahyaRahimov,@Rui Kashaire this makes even funnier ur situation lul,2020-04-02T09:36:44Z,4,Reply
@YahyaRahimov,@Rui Kashaire hahahaha omg that guy lol man,2020-04-02T09:45:43Z,0,Reply
@gorgono1,"its is fucking boring, believe me",2020-04-02T21:14:48Z,10,Reply
@BianLee,Unlike all those cringey prorgrammers who eat 30 meals a day,2020-04-04T17:45:01Z,10,Reply
@kaustav07,EPIC,2020-04-01T07:58:51Z,0,Main Comment
@shauraysingh2563,"Hey, should I time myself while doing such problems ?",2020-04-01T07:57:05Z,0,Main Comment
@kamildebowski7003,"doesn't matter much, I never time myself when just practicing",2020-04-01T10:42:17Z,1,Reply
@zhbdripon,That struggle when a grandmaster tried to be a YouTuber 😹,2020-04-01T07:56:49Z,18,Main Comment
@xordux7,What struggle?,2020-04-01T09:25:18Z,3,Reply
@kawsarahmmedchandon1462,"Hey, I love your videos on problem solving. I always try to wach your competitive programming live session. I have learned so much from those. dont be like other crappy youtubers who are regularly making this kind of content like how to become a software developer or how to start competitive programming. we all know it is all about practice, no one can be as good as a person who train him/herself every single day. so bring more explanation about algorithms and data structures and mathematics. and stay at home dear :)",2020-04-01T07:56:41Z,13,Main Comment
@vikashprasad3279,Give me heart❤️❤️❤️🥺🥺,2020-04-01T07:55:50Z,0,Main Comment
@cplusplussizeddick1430,"Ha, forgot to edit out 3:39?? Or funny humor lol",2020-04-01T07:55:46Z,0,Main Comment
@ashrafulfuad2967,thanks for such an advice,2020-04-01T07:55:34Z,0,Main Comment
@srinivast84,Can u make a video in how to debug a program.,2020-04-01T07:53:11Z,0,Main Comment
@architbhonsle7356,I'd say Hackerrank works better for learning. Just go to the Problem Solving section and do whatever comes up in recommended. You can sort by difficulty and problem type.The submission and testing process and the UI is better. Codeforces is great but only for contests.,2020-04-01T07:52:34Z,0,Main Comment
@davidakoji3696,I see bear LIMAK on yo t-shirt.,2020-04-01T07:52:29Z,0,Main Comment
@kushaltandon7720,Humour with serious face that's errichto for you,2020-04-01T07:49:05Z,0,Main Comment
@TheSkeef79,"Hello, i found something interesting in my skills, i am doing CP for 1.5 years and i'm purple now. But i found that I'm bad at solving tasks from competitions like open cup div2 , or some school competitions, tasks in this competitions feels so different and so hard for me. And now I'm start thinking that when you good at codeforces completions you only good at them, but not in other competitions. I know it sounds strange , but i feel it like that. So, do you have any suggestions why this happens?",2020-04-01T07:48:00Z,31,Main Comment
@lukagogoladze4470,"Most CF problems are a little different from problems that appear on international and national olympiads (IOI, POI, USACO, etc). I think it's because CF contests usually last for 2.5 hours and there are 5-6 problems, after comparing that to 5 hours and 3-4 problems (in olympiads I listed above) you kinda get the idea of difference in difficulty. So basically being good at CF and being good at CP in general are slightly different things. I personally stopped doing CF and got back to it couple of weeks ago. My rating is lower than it was 1 year ago even though I excelled in CP generally speaking.",2020-04-01T10:27:20Z,3,Reply
@muhammadkamalshafi4403,"I think the first reason is school competitions usually have more classic problems(at least in my country), while on codeforces you have many different round and author, so the topics of problem probably more diverse from one contest to another. At some of the time you can get high rating changes while on other time you lose a little rating. 

Another reason I can think of is that depending on the level of competition you participate. Is it for high school or is it for University students. I found out that high school competitions problems have more ad hoc/dp type problem and they didn't have that many hard data structures(need more knowledge) problems compare to University competitions.

The last reason is, on codeforces you need to be a fast coder. You can be better at this after you practice by joining many of such contests. While problems on competitions usually are on a deeper level and you need time and more knowledge and the score of problem won't change even if you solved it on last minute.",2020-04-01T11:48:18Z,1,Reply
@Errichto,"The style slightly differs but not enough that you will be a beast in one platform and a noob somewhere else. Open cup requires more knowledge and is kind of more advanced, I would say.",2020-04-01T12:06:18Z,32,Reply
@jamshidchungath,👋,2020-04-01T07:47:53Z,0,Main Comment
@adityaranjanmohanty5980,Can i use java for competitive programming?,2020-04-01T07:47:41Z,0,Main Comment
@systemflaws,"Thanks, Errichto!
The practice is a key to become a red coder.",2020-04-01T07:46:31Z,0,Main Comment
@MehediHasan-wx3no,"Hey Errichto , can you make a playlist or atleast some videos some thing like Dynamic Programming for Beginner( Surely not beginner in programming , Beginner in DP)",2020-04-01T07:45:57Z,1,Main Comment
@CarlosMartinez-jf3rn,atcoder [dot] jp/contests/dp/tasks try this if u get stuck check the solutions in submits section,2020-04-01T08:25:52Z,1,Reply
@varunmanchanda3972,"Practice, Practice and Practice.............",2020-04-01T07:45:55Z,0,Main Comment
@MaskedChroniclesReal,humour++,2020-04-01T07:45:39Z,3,Main Comment
@so7am96,"*cringing* xD
loved the sense of humor :))",2020-04-01T07:45:22Z,1,Main Comment
@prakash_77,02:21 PROMLEMS 😁😁,2020-04-01T07:44:09Z,2,Main Comment
@Errichto,:O that actually wasn't intentional,2020-04-01T09:39:31Z,2,Reply
@danilzashikhin3591,Nice teddy bear,2020-04-01T07:44:06Z,2,Main Comment
@potassium_cyanide_boy8515,"Hi bro...
What if i am not that much talented..What if i am not good in math and puzzle solving. Can i still able to build good programming skill..?",2020-04-01T07:43:37Z,0,Main Comment
@bparanj,Yes. You need the desire and motivation to work through coding problems.,2020-05-07T05:36:32Z,0,Reply
@danilzashikhin3591,"Summary: Kamil has N videos. I will review them and estimate their value
(Some text)
Final conclusion: Kamil is a clown",2020-04-01T07:43:07Z,3,Main Comment
@aryamanarora3630,Kamil is a clown,2020-04-01T10:41:48Z,1,Reply
@prakash_77,02:21 Which standings are these? Where can I see it?,2020-04-01T07:39:05Z,0,Main Comment
@Errichto,"Problemset -> standings
It shows the total number of problems you solved in CF.",2020-04-01T07:41:48Z,1,Reply
@prakash_77,@Errichto Did you filter it somehow. Because it shows unrated coders also and from all regions. Yours looks like of a specific region or country.,2020-04-01T07:49:58Z,0,Reply
@MaskedChroniclesReal,They're his friends,2020-04-01T07:54:10Z,2,Reply
@Errichto,"@prakash_77 As @Palash said, it's my friends standings.",2020-04-01T09:44:39Z,1,Reply
@mursalinahmed3463,I have a problem of being stuck...that is a good point to not think about it.,2020-04-01T07:37:21Z,1,Main Comment
@albarakati2003,I like your joke !,2020-04-01T07:37:13Z,0,Main Comment
@zeusjean,vales oro,2020-04-01T07:36:49Z,1,Main Comment
@juliangu1969,great video!,2020-04-01T07:36:44Z,0,Main Comment
@rohitsinha3519,Obviously 1st.  Practice for i don't knw how much of hours..,2020-04-01T07:35:58Z,0,Main Comment
@hacker-7214,The only thing I hate about codeforces is reading input and small test cases. Also do u need to have high iq and be realllly good at math? I'm above average for both,2020-04-01T07:35:56Z,1,Main Comment
@royrogers9680,"Hell no. I've met people who are naturally good and others who work their asses off. A ""Genius"" simply naturally is good at something and works their ass off. In the end, grinding is the key to winning. I promise you no amount of iq will beat even an average person's experience. As for math, competitive math is what's most helpful, number theory, combinatorics, etc. Advanced Calculus is quite useless (although on rare occasion I've seen people use it, and it was an unintentional harder solution) stick to summing series and modular arithmetic",2020-04-01T08:19:38Z,0,Reply
@saiham4500,"Do three things, practice... practice... practice...",2020-04-01T07:35:49Z,0,Main Comment
@kartaLaLa,"A red coder
Errichto
Sounds similar 😂",2020-04-01T07:35:40Z,241,Main Comment
@tagberli,and looks also similar,2020-04-02T05:16:01Z,5,Reply
@zyro9922,So true lol. I thought the same.,2020-05-04T17:23:41Z,0,Reply
@sanketgadge9060,i really liked that......hello programmers! I am like halo errichtooo,2020-04-01T07:32:59Z,0,Main Comment
@aishwaryaramesh4877,"April Fool's joke is brilliant xD   Great content, simply love it! Thank you Errichto! Stay blessed :D",2020-04-01T07:32:46Z,1,Main Comment
@piyushnaithani7689,Practice 🤩,2020-04-01T07:31:39Z,0,Main Comment
@geekynoob147,"So , should I read the book in the thumbnail or not ? 😅😂",2020-04-01T07:30:53Z,8,Main Comment
@SantoshKumar-nc7uw,Hello programmers😇,2020-04-01T07:29:07Z,1,Main Comment
@x87-64,Stop clickbaiting and go back to your normal videos please,2020-04-01T07:28:31Z,1,Main Comment
@jporwal09,can you please suggest some medium level problems for DP?,2020-04-01T07:27:14Z,0,Main Comment
@hemantpatel1413,Slightly above your comfort zone. That's my favourite.,2020-04-01T07:26:00Z,98,Main Comment
@jay-rathod-01,🤟♥️🤟,2020-04-01T07:25:58Z,1,Main Comment
@fuadalhasan1784,More funny and aslo helpful video.  😍😍😍,2020-04-01T07:25:39Z,1,Main Comment
@MasudRana-uw5mb,Can I see solution any problem?,2020-04-01T07:24:49Z,1,Main Comment
@nikhilkr1005,Well the starting April Fool joke is the bitter truth 🤐😄,2020-04-01T07:24:29Z,63,Main Comment
@tanzidulislam7687,💜💜,2020-04-01T07:23:19Z,1,Main Comment
@amarks444,Hahaha that April fool 😂 joke was  Awesome.Apart From that Whole Video is Good👌.,2020-04-01T07:22:40Z,11,Main Comment
@huyle-hb8mn,=)),2020-04-01T07:22:16Z,1,Main Comment
@SinghSidhuKuldeep,Harambe would be proud,2020-04-01T07:21:51Z,2,Main Comment
@Errichto,F,2020-04-01T07:23:02Z,4,Reply
@VatsalSharma07082000,The last part xD,2020-04-01T07:21:24Z,1,Main Comment
@kylehipolito8847,Can you do a guide on macros please?,2020-04-01T07:21:09Z,1,Main Comment
@Errichto,"Here you go: don't care about them.
It's something that will only distract you. Start using them once you are very good already.",2020-04-01T07:28:23Z,3,Reply
@kylehipolito8847,@Errichto Thanks man! I'll do my best :D,2020-04-01T07:40:50Z,0,Reply
@Errichto,You won't believe number 4.,2020-04-01T07:20:51Z,1804,Main Comment
@aayushsharma1048,@Errichto Do we need to join any coaching or courses to become a competitive programmer or self learning and practicing is enough ? And thank you for such knowledgeable content.,2020-04-01T07:30:31Z,36,Reply
@Errichto,@aayushsharma1048 The video says everything that needs to be done.,2020-04-01T07:41:16Z,202,Reply
@iitnakanpur..,The thing I won't believe is 1.6k views in just 22min.😂😂😂,2020-04-01T07:43:33Z,36,Reply
@dr.darkfurygaming9174,"@Errichto how to understand problem quickly 
Sometimes i stuck what problem asking for 
Thanks for great content",2020-04-01T08:11:40Z,9,Reply
@bobturner2764,"Hi I'm trying to learn python. I have set up an ide and know the basics. Like data types. Lists dict, tuples. Some idea of classes and objects. Functions , lambda . Any advice on how to practice and learn more and what resources to use.",2020-04-01T08:13:43Z,2,Reply
@videocorner3305,Thanks for the tips bro.,2020-04-01T07:19:36Z,1,Main Comment
@Rahulmishra-iv9dt,Practice ☺☺☺,2020-04-01T07:19:29Z,1,Main Comment
@Gig_801,I liked the first one 😎,2020-04-01T07:18:01Z,1,Main Comment
@crazymemes4080,If mathematics is not a background can we solve problems? With no background in mathematics,2020-04-01T07:17:13Z,8,Main Comment
@dr.darkfurygaming9174,It might tough,2020-04-01T08:07:00Z,1,Reply
@royrogers9680,Lmao yes. You definitely can. I have many competitive friends who can't add properly but they can definitely code and construct algorithms. However if you wish to achieve higher ratings then you have to learn some competitive math (mainly number theory and combinatorics),2020-04-01T08:11:38Z,1,Reply
@crazymemes4080,@royrogers9680 haha.. yeah,2020-04-01T08:13:18Z,0,Reply
@crazymemes4080,@royrogers9680 i was just wondering 🤣🤣,2020-04-01T08:13:32Z,0,Reply
@blackside7108,What do u mean not background? Not at all? Or just need i little bit math practise?,2020-04-01T15:34:35Z,0,Reply
@TechWithSabri,"A little laughter earns you a lot of programming
Respect Bro we love what you doing !!!",2020-04-01T07:17:10Z,117,Main Comment
@yemiyesufu,6th👏🏽👏🏽👏🏽,2020-04-01T07:16:21Z,2,Main Comment
@mdsarwarraish8763,I am your first viewer,2020-04-01T07:15:54Z,1,Main Comment
@MCGurrenlagan,Thanks bro 🤠,2020-04-01T07:14:57Z,1,Main Comment
@TravellerMann,Great video 👍 thanks,2020-04-01T07:14:26Z,1,Main Comment
@crazymemes4080,Yo bro,2020-04-01T07:14:17Z,1,Main Comment
@poorgang,First,2020-04-01T07:14:15Z,2,Main Comment
